,Label,Kind,GroupRel,StakeRel,RankGroup,RankStake,RankAbsolute,Alignment
0,Dei dati e delle informazioni,Unknown,78.87606623181134,0.0,5.0,0.0,5.0,55.77380130583305
1,Rilevante,Unknown,0.0,10.659898477157356,0.0,1.6666666666666667,0.0,7.537686499958117
2,Sviluppo della mobilit sostenibile,Unknown,27.094831911690918,70.0507614213198,3.3333333333333335,3.3333333333333335,3.3333333333333335,30.37442904842991
3,Tutela e rispetto dei diritti,Unknown,18.21374811841445,150.50761421319797,1.6666666666666667,5.0,1.6666666666666667,93.5458898250065
4,Condotta etica del business,Unknown,300.0,236.5482233502538,10.0,6.666666666666667,10.0,44.86718154736976
5,Innovazione e tecnologia smart,Unknown,157.451078775715,256.34517766497464,6.666666666666667,8.333333333333334,6.666666666666667,69.92868794392851
6,Gestione delle infrastrutture volta alla continuit del servizio,Unknown,271.70095333667837,300.0,8.333333333333334,10.0,8.333333333333334,20.010447796749265
